{
  "$schema": "../references/creative-genome/schemas/reference-bundle.schema.json",
  "schema_version": "1.0.0",
  "creative_bundle_id": "CB-DRAFT",
  "query_id": "RQ-DRAFT",
  "content_id": "",
  "snapshot_id": "creative-genome-2026-08-02-v1",
  "status": "draft",
  "claim_mode": "editorial_explainer",
  "reader_contract": {
    "problem_3s": "",
    "insight_10s": "",
    "action_30s": ""
  },
  "selected_direction": "",
  "coherence_rationale": "",
  "tiger_precedent_ids": [],
  "references": []
}
